Chinese (Simplified),English,Category,Description,Reference,Chinese (Traditional),Korean,Japanese,Swedish,Polish,Dutch,Indonesian,Spanish,Turkish,Vietnamese,French,German,Italian,Russian,Portuguese,Thai,Malaysian,Arabic
设置锚点,Set Home Port,,,,錨點設置,앵커 설정,母港設定,Ställ in hemmahamn,Ustaw port macierzysty,Thuishaven instellen,Atur Bandariksa Markas,Establecer puerto base,Ana Liman Ayarla,Thiết Lập Cảng Chính,Installer un dépôt,Depot einrichten,Imposta il porto di origine,Установить порт базирования,Definir Porto de Origem,ตั้งเป็นฐานปล่อยยานหลัก,Tetapkan Pelabuhan Utama,تعيين الميناء الرئيسي
会员特权,Membership Privileges,,,,會員特權,멤버십 혜택,会員特典,Medlemskapsförmån,Przywileje dla członków,Lidmaatschapsvoordelen,Hak Istimewa Keanggotaan,Privilegios de membresía,Üyelik Ayrıcalıkları,Đặc Quyền Thành Viên,Privilèges d'abonnement,Mitgliedschaftsprivilegien,Privilegi di adesione,привилегии участника,Privilégios Associativos,สิทธิพิเศษสำหรับสมาชิก,Keistimewaan Keahlian,امتيازات العضوية
头目,Boss,,,,頭目,보스,ボス,Boss,Boss,Baas,Bos,Jefe,Boss,Trùm,Boss,Boss,Boss,Босс,Chefe,บอส,Bos,الزعيم
助力,Support,,,,點擊助力,터치하여 지원,支援する,Ge support,Wsparcie,Ondersteunen,Dukung,Apoyo,Destek,Hỗ Trợ,Aider,Unterstützung,Supporto,Поддержать,Apoiar,ช่วยเหลือ,Sokongan,الدعم
巧言的哈格尔,Hagel the Silver-Tongued,,,,巧言的哈格爾,감언이설의 하겔,舌先三寸のハーゲル,Hagel Silvertunga,Hagel Srebrny Język,Hagel de welbespraakte,Hagel the Silver-Tongued,Hagel el Lengua de Plata,Gümüş Dilli Hagel,Hagel Khéo Ăn Nói,Hagel langue-d'argent,Hagel der Silberzüngige,Hagel lingua d'argento,Хейгел Златоуст,"Hagel, o Loquaz",ฮาเกล จอมคารม,Hagel Si Petah Berbicara,هيجل ذو الكلام المعسول
狂焰的博拉克,Borak the Flamebound,,,,狂焰的博拉克,광염의 보라크,狂炎のボラク,Borak Flambunden,Borak Pożoga,Borak de vuurgebondene,Borak the Flamebound,Borak el Ígneo,Alevbaz Borak,Borak Rực Cháy,Borak né des flammes,Borak der Flammenschwinger,Borak la fiamma,Борак Пламенный,"Borak, o Impetuoso",โบแรค ผู้ลุกโชน,Borak Si Penunggang Api,بوراك أسير النار
科技研发,Technology Research,,,,科技研發,,,Teknikforskning,Badania technologii,Technologieonderzoek,Riset Teknologi,Investigación tecnológica,Teknoloji Araştırması,Nghiên Cứu Công Nghệ,Recherche technologique,Tech Research,Ricerca tecnologica,Исследование технологий,Pesquisa Tecnológica,การวิจัยเทคโนโลยี,Penyelidikan Teknologi,الأبحاث التقنية
活跃里程碑,Active Milestone,,,,活躍里程碑,활약 마일스톤,アクティブマイルストーン,Aktiv milstolpe,Aktywny kamień milowy,Actieve mijlpaal,Pencapaian Aktif,Hito activo,Aktif Başarım Noktası,Cột Mốc Đang Hoạt Động,Étape active,Aktiver Meilenstein,Traguardo attivo,Активная веха,Marco Ativo,เป้าหมายที่ดำเนินอยู่,Pencapaian Maksimum,الإنجاز النشط
对决之星,Duel Star,,,,對決之星,대결의 별,対決スター,Duellstjärna,Gwiazda pojedynków,Duelster,Bintang Duel,Estrella del duelo,Düello Yıldızı,Ngôi Sao Quyết Đấu,Star des duels,Duellstern,Stella del duello,Звезда поединков,Estrela do Duelo,ดาวท้าดวล,Bintang Pertarungan,نجم المبارزة
战场之星,Star of the Battlefield,,,,戰場之星,전장의 스타,戦場スター,Slagfältets stjärna,Gwiazda Pola Bitwy,Ster van het slagveld,Bintang Medan Tempur,Estrella del campo de batalla,Savaş Alanının Yıldızı,Ngôi Sao Chiến Trường,Étoile du champ de bataille,Stern des Schlachtfelds,Astro del campo di battaglia,Звезда на поле боя,Estrela do Campo de Batalha,ดาวเด่นแห่งสมรภูมิรบ,Bintang Medan Pertempuran,نجم المعركة
荣誉行商,Honorable Trader,,,,榮譽行商,명예 트레이더,栄誉の行商人,Respekterad handlare,Honorowy Handlarz,Eervolle handelaar,Trader Terhormat,Comerciante honorable,Onursal Tüccar,Thương Nhân Đáng Kính,Commerçant honorable,Ehrenhafter Händler,Mercante onorevole,Почетный торговец,Negociante Honorável,ผู้ค้าผู้ทรงเกียรติ,Pedagang yang Mulia,تاجر شريف
演训战舰,Drill Cruiser,,,,演訓戰艦,훈련용 군함,演習巡洋艦,Träningskryssare,Krążownik ćwiczebny,Boorkruiser,Drill Cruiser,Crucero perforador,Sondaj Kruvazörü,Tàu Tuần Dương Diễn Tập,Croiseur-foreur,Übungskriegsschiff,Incrociatore da trivellazione,Учебный крейсер,Cruzador de Treinamento,ครูเซอร์เจาะทำลาย,Kapal Gerudi,طراد التدريب
当前服务器,Current Server,,,,當前伺服器,현재 서버,現在のサーバー,Nuvarande server,Bieżący serwer,Huidige server,Server Saat Ini,Servidor actual,Mevcut Sunucu,Máy Chủ Hiện Tại,Serveur actuel,Aktueller Server,Server attuale,Текущий сервер,Servidor Atual,เซิร์ฟเวอร์ปัจจุบัน,Pelayan Semasa,الخادم الحالي
相邻服务器,Adjacent Server,,,,相鄰伺服器,인접 서버,隣接サーバー,Intilliggande server,Sąsiedni serwer,Aangrenzende server,Server Terdekat,Servidor adyacente,Komşu Sunucu,Máy Chủ Lân Cận,Serveur adjacent,Benachbarter Server,Server adiacente,Соседний сервер,Servidor Adjacente,เซิร์ฟเวอร์ใกล้เคียง,Pelayan Bersebelahan,الخادم المجاور
不朽祈祷舰,Immortal Ascendancy Shrine,,,,不朽祈禱艦,불멸의 기도함,不滅の祈祷艦,Ascendentens odödliga helgedom,Nieśmiertelna świątynia Supremacji,Onsterfelijk heiligdom van de Ascendancy,Kuil Ascendancy Abadi,Templo de la Ascendencia inmortal,Ölümsüz Yükseliş Tapınağı,Điện Thờ Hạm Chí Tôn Bất Tử,Sanctuaire immortel de l'Ascendance,Unsterblicher Ascendancy-Schrein,Santuario della Supremazia immortale,Бессмертное святилище «Абсолюта»,Santuário da Ascendência Imortal,ยานบูชาลัทธิเรืองอำนาจอิมมอร์ทัล,Kuil Kekuasaan Abadi,ضريح السلطة الخالد
朝圣卫队,Pilgrim Guards,,,,朝聖衛隊,성역 수호단,巡礼衛隊,Pilgrimsvakt,Straż Pielgrzymów,Pelgrimswachters,Penjaga Pilgrim,Guardias peregrinos,Seyyah Muhafızları,Hộ Vệ Hành Hương,Gardes pèlerins,Pilgerwachen,Guardie pellegrine,страж-паломник,Guardas Peregrinos,องครักษ์ผู้แสวงบุญ,Pengawal Jemaah,الطليعة المقدسة
群星眷顾,Blessed Ones,,排行榜名,,群星眷顧,별들의 축복,星々の祝福,De välsignade,Błogosławieni,Gezegenden,Blessed Ones,Bendecidos,Kutsanmış Olanlar,Người Được Ban Phước,Les élus,Gesegnete,Benedetti,Благословенные,Abençoados,ผู้ได้รับพร,Yang Diberkati,المباركون
最强猎手,Strongest Hunter,,,,最強獵手,최강 헌터,最強のハンター,Starkast jägare,Najsilniejszy łowca,Sterkste jager,Pemburu Terkuat,Cazador más fuerte,En Güçlü Avcı,Thợ Săn Mạnh Nhất,Chasseur suprême,Stärkster Jäger,Cacciatore più forte,Сильнейший охотник,Caçador Mais Forte,นักล่าผู้แข็งแกร่งที่สุด,Pemburu Terkuat,الصائد الأقوى
背包统计,Inventory Stats,,,,背包統計,배낭 통계,バッグ統計,Förvaringsstatistik,Statystyki inwentarza,Inventarisstatistieken,Status Inventaris,Estadísticas de inventario,Envanter İstatistikleri,Thống Kê Kho Hàng,Stats de l'inventaire,Inventarwerte,Statistiche dell'inventario,Показатели инвентаря,Atributos do Inventário,สถิติคลัง,Statistik Inventori,إحصاءات المخزون
声望点数,Reputation Points,,,,聲望點數,명성 포인트,名声pt,Ryktespoäng,Punkty reputacji,Reputatiepunten,Poin Reputasi,Puntos de reputación,İtibar Puanları,Điểm Danh Tiếng,Points de réputation,Rufpunkte,Punti reputazione,Очки репутации,Pontos de Reputação,คะแนนชื่อเสียง,Mata Reputasi,نقاط السمعة
史诗训练手册,Epic Training Manual,,,,史詩訓練手冊,에픽 훈련 매뉴얼,エピック訓練マニュアル,Episk träningsmanual,Epicki podręcznik szkoleniowy,Epische trainingshandleiding,Manual Pelatihan Epik,Manual de entrenamiento épico,Destansı Eğitim Kılavuzu,Sổ Tay Huấn Luyện Cực Phẩm,Manuel d'entraînement épique,Episches Trainingshandbuch,Manuale di addestramento epico,Эпическое учебное пособие,Manual de Treinamento Épico,คู่มือการฝึกมหากาพย์,Manual Latihan Epik,دليل التدريب الملحمي
新手推荐,Beginner's Choice,,,,新手推薦,초보 추천,初心者向け,Nybörjarens val,Dla nowicjuszy,Goed voor beginners,Pilihan Pemula,Elección de principiante,Başlangıç Seçimi,Lựa Chọn Của Người Mới,Choix du débutant,Anfängerauswahl,Scelta del principiante,Выбор новичка,Escolha do Iniciante,ตัวเลือกสำหรับมือใหม่,Pilihan Pemula,اختيار المبتدئين
中期过渡,Mid-Game Build,,,,中期過渡,중간 과도기,中盤向け構成,För mitt i spelet,Dla średniozaawansowanych,Goed voor halverwege,Build Mid-Game,Construcción a mitad de partida,Oyun Ortası Dizilimi,Bộ Cho Giữa Game,Composition mid-game,Fortgeschrittener Aufbau,Formazione di gioco intermedio,Промежуточная фаза,Formação de Meio de Jogo,บิลด์กลางเกม,Binaan Pertengahan Permainan,تصميم منتصف اللعبة
顶尖大神,Pro Recommendation,,,,頂尖大神,최고 고수,上級者向け,Proffsrekommendation,Dla weteranów,Aanbevolen voor professionals,Rekomendasi Pro,Recomendación profesional,Profesyonel Önerisi,Đề Xuất Cho Dân Chuyên,Recommandation pro,Profi-Empfehlung,Formazione pro,Выбор профи,Formação de Alto Nível,แนะนำสำหรับมือโปร,Pengesyoran Pro,توصية محترف
阵容应用,Confirm Lineup,,,,陣容應用,진영 적용,編成を適用,Bekräfta uppställning,Potwierdź skład,Opstelling bevestigen,Konfirmasi Susunan,Confirmar formación,Dizilimi Onayla,Xác nhận Đội Hình,Confirmer la composition,Aufstellung bestätigen,Conferma formazione,Подтвердить состав,Confirmar a Escalação,ยืนยันทีม,Barisan yang Disahkan,تأكيد التشكيلة
未拥有,Not Owned,,,,未擁有,미보유,未所持,Ägs inte,Nie masz,Niet in bezit,Tidak Punya,No adquirido,Sahip Değilsin,Chưa Sở Hữu,Non possédé,Nicht im Besitz,Non in tuo possesso,Отсутствует,Não Adquirido,ยังไม่มี,Belum Dimiliki,غير مملوك
原阵容,Original Lineup,,,,原陣容,기존 진영,元の編成,Ursprunglig uppställning,Oryginalny skład,Oorspronkelijke opstelling,Susunan Asli,Formación original,Orijinal Dizilim,Đội Hình Ban Đầu,Composition originale,Ursprüngliche Aufstellung,Formazione originale,Изначальный состав,Escalação Original,ทีมเดิม,Barisan Asli,التشكيلة الأصلية
移动设置,Movement Settings,,,,移動設定,이동 설정,移動設定,Rörelseinställningar,Ustawienia ruchu,Verplaatsingsinstellingen,Pengaturan Gerak,Ajustes de movimiento,Hareket Ayarları,Cài Đặt Di Chuyển,Paramètres de déplacement,Bewegungseinstellungen,Impostazioni movimento,Настройки передвижения,Configurações de Movimento,การตั้งค่าการเคลื่อนที่,Tetapan Pergerakan,إعدادات الحركة
今日特供,Daily Deals,,,,今日特供,오늘의 특가,本日の特売,Dagliga erbjudanden,Oferty dnia,Dagelijkse aanbiedingen,Promo Harian,Ofertas diarias,Günün Fırsatları,Ưu Đãi Hằng Ngày,Offres quotidiennes,Tagesangebote,Offerte giornaliere,Акции дня,Ofertas Diárias,ข้อเสนอประจำวัน,Tawaran Harian,الصفقات اليومية
发掘次数,Excavation Allowance,,,,發掘次數,발굴 횟수,発掘回数,Utgrävningsförsök,Dozwolona liczba wykopalisk,Aantal opgravingen,Izin Penggalian,Permiso de excavación,Kazı İzni,Lượt Khai Quật,Indemnité de fouilles,Ausgrabungsversuche,Quota di scavi,лимит раскопок,Permissão de Escavação,จำนวนการขุดที่อนุญาต,Peruntukan Penggalian,فرص التنقيب
伊娃,Eva,,,,伊娃,에바,エヴァ,Eva,Eva,Eva,Eva,Eva,Eva,Eva,Eva,Eva,Eva,Эва,Eva,อีวา,Eva,إيفا
动能技能增伤,Kinetic Ability Damage Boost,,,,動能技能增傷,키네틱 스킬 피해 증가,実弾スキルダメージ増加,Skadeboost för kinetisk förmåga,Wzmocnienie obrażeń umiejętności kinetycznych,Schadebonus kinetische skills,Boost Damage Skill Kinetic,Aumento de daño de habilidad cinética,Kinetik Yetenek Hasarı Artışı,Tăng Cường Sát Thương Kỹ Năng Động Năng,Boost des dégâts de capacité cinétiques,Boost für Kinetik-Fähigkeitsschaden,Aumento danno Abilità cinetica,Усиление урона от кинетических способностей,Reforço de Dano de Habilidade Cinética,บูสต์ความเสียหายทักษะคิเนติก,Peningkatan Kerosakan Keupayaan Kinetik,تعزيز ضرر القدرة الحركية
普攻伤害增加,Normal Attack Damage Increase,,,,普攻傷害增加,일반 공격 피해 증가,通常攻撃ダメージ増加,Skadeökning för vanlig attack,Zwiększenie obrażeń zwykłego ataku,Verhoging normale aanvalsschade,Peningkatkan Damage Serangan Normal,Aumento de daño de ataque normal,Normal Saldırı Hasarı Artışı,Tăng Sát Thương Đánh Thường,Augmentation des dégâts d'attaque normale,Erhöhung von normalem Angriffsschaden,Aumento danno Attacco normale,Увеличение урона от обычной атаки,Aumento de Dano de Ataque Normal,เพิ่มความเสียหายจากการโจมตีปกติ,Peningkatan Kerosakan Serangan Biasa,يزيد من ضرر الهجوم العادي
光束技能增伤,Beam Ability Damage Boost,,,,光束技能增傷,빔 스킬 피해 증가,ビームスキルのダメージ増加,Skadeboost för strålförmåga,Wzmocnienie obrażeń umiejętności laserowych,Schadebonus straalskills,Boost Damage Skill Beam,Aumento de daño de habilidad de rayo,Işın Yetenek Hasarı Artışı,Tăng Cường Sát Thương Kỹ Năng Quang Tiễn,Boost des dégâts de capacité de type faisceau,Boost für Strahlen-Fähigkeitsschaden,Aumento danno Abilità raggio,Усиление урона от фотонных способностей,Reforço de Dano de Habilidade de Rajada,บูสต์ความเสียหายจากทักษะลำแสง,Peningkatan Kerosakan Keupayaan Pancaran,تعزيز ضرر القدرة الشعاعية
普攻伤害减免,Normal Attack Damage Reduction,,,,普攻傷害減免,일반 공격 피해 감소,通常攻撃ダメージ軽減,Skademinskning för vanlig attack,Redukcja obrażeń od zwykłego ataku,Vermindering normale aanvalsschade,Pengurangan Damage Serangan Normal,Reducción de daño de ataque normal,Normal Saldırı Hasar Azaltması,Giảm Sát Thương Đánh Thường,Réduction de dégâts d'attaque normale,Reduzierung von normalem Angriffsschaden,Riduzione Danno da attacco normale,Снижение урона от обычной атаки,Redução de Dano de Ataque Normal,ลดความเสียหายจากการโจมตีปกติ,Pengurangan Kerosakan Serangan Biasa,تقليل ضرر الهجوم العادي
离子技能增伤,Ion Ability Damage Boost,,,,離子技能增傷,이온 스킬 피해 증가,イオンスキルダメージ増加,Skadeboost för jonförmåga,Wzmocnienie obrażeń umiejętności jonowych,Schadebonus ionskills,Boost Damage Skill Ion,Aumento de daño de habilidad de ion,İyon Yetenek Hasarı Artışı,Tăng Cường Sát Thương Kỹ Năng Ion,Boost des dégâts de capacité ioniques,Boost für Ionen-Fähigkeitsschaden,Aumento danno Abilità ionica,Усиление урона от ионных способностей,Reforço de Dano de Habilidade Iônico,บูสต์ความเสียหายจากทักษะไอออน,Peningkatan Kerosakan Keupayaan Ion,تعزيز ضرر القدرة الأيونية
反击伤害减免,Counterattack Damage Reduction,,,,反擊傷害減免,반격 피해 감소,反撃ダメージ軽減,Skademinskning för motattack,Redukcja obrażeń od kontrataku,Vermindering tegenaanvalsschade,Pengurangan Damage Serangan Balasan,Reducción de daño de contraataque,Karşı Saldırı Hasarı Düşüşü,Giảm Sát Thương Phản Công,Réduction des dégâts de contre-attaque,Reduzierung von Gegenangriffsschaden,Riduzione danno da Contrattacco,Снижение урона от контратак,Redução de Dano de Contra-ataque,ลดความเสียหายจากการโจมตีสวนกลับ,Pengurangan Kerosakan Serangan Balas,تقليل ضرر الهجوم المضاد
红包记录,Bounty Records,,,,紅包記錄,보상 기록,ギフト履歴,Skattlogg,Historia nagród,Premiegegevens,Catatan Imbalan,Registros de Recompensas,Ödül Geçmişi,Lịch Sử Bao Lì Xì,Historique des primes,Gabenaufzeichnungen,Registro delle ricompense,История наград,Registros de Prêmios,บันทึกค่าหัว,Rekod Ganjaran,سجلات المكافأة
红包,Bounty,,,,紅包,보상,ギフト,Skatt,Nagroda,Premie,Imbalan,Recompensa,Ödül,Bao Lì Xì,Prime,Gabe,Ricompensa,Награда,Prêmio,ค่าหัว,Ganjaran,الجائزة
文本语言,Text Language,,,,文字語言,텍스트 언어,テキスト言語,Textspråk,Język tekstu,Teksttaal,Bahasa Teks,Idioma del texto,Metin Dili,Ngôn Ngữ Văn Bản,Langues,Textsprache,Lingua del testo,Язык текста,Idioma do Texto,ภาษาข้อความ,Bahasa Teks,لغة النص
图像,Graphics,,,,圖像,이미지,グラフィック,Grafik,Grafika,Graphics,Grafis,Gráficos,Grafikler,Đồ Họa,Graphismes,Grafik,Grafica,Графика,Gráficos,กราฟิก,Grafik,الرسوميات
画面设置,Graphics Settings,,,,畫面設定,화면 설정,グラフィック設定,Grafikinställningar,Ustawienia grafiki,Grafische instellingen,Pengaturan Grafis,Ajustes de gráficos,Grafik Ayarları,Cài Đặt Đồ Họa,Paramètres graphiques,Grafikeinstellungen,Impostazioni grafiche,Настройки графики,Configurações de Gráficos,การตั้งค่ากราฟิก,Tetapan Grafik,إعدادات الرسوميات
画面品质,Graphics Quality,,,,畫質,화면 품질,画質設定,Grafikkvalitet,Jakość grafiki,Grafische kwaliteit,Kualitas Grafis,Calidad de gráficos,Grafik Kalitesi,Chất Lượng Đồ Họa,Qualité des graphismes,Grafikqualität,Qualità grafica,Качество графики,Qualidade dos Gráficos,คุณภาพกราฟิก,Kualiti Grafik,جودة الرسومات
显示设置,Display Settings,,,,顯示設定,표시 설정,表示設定,Displayinställningar,Ustawienia wyświetlania,Beeldinstellingen,Pengaturan Display,Ajustes de pantalla,Görüntü Ayarları,Cài Đặt Hiển Thị,Paramètres d'affichage,Anzeigeeinstellungen,Impostazioni schermo,Настройки экрана,Configurações de Exibição,การตั้งค่าการแสดงผล,Tetapan Paparan,إعدادات العرض
竖屏,Portrait,,,,豎屏,세로 화면,縦画面,Porträtt,Portret,Portret,Potret,Retrato,Dikey,Dọc,Portrait,Porträt,Ritratto,Вертик.,Retrato,แนวตั้ง,Potret,الصورة الشخصية
横屏,Landscape,,,,橫屏,가로 화면,横画面,Landskap,Krajobraz,Landschap,Lanskap,Horizontal,Yatay,Ngang,Paysage,Querformat,Panoramica,Горизонт.,Paisagem,แนวนอน,Landskap,المشهد
全屏,Fullscreen,,,,全螢幕,전체 화면,フルスクリーン,Helskärm,Pełny ekran,Volledig scherm,Layar Penuh,Pantalla completa,Tam Ekran,Toàn Màn Hình,Plein écran,Vollbild,A schermo intero,Во весь экран,Tela Cheia,เต็มหน้าจอ,Skrin Penuh,ملء الشاشة
显示模式,Display Mode,,,,顯示模式,표시 모드,表示モード,Displayläge,Tryb wyświetlania,Beeldmodus,Mode Display,Modo de pantalla,Görüntü Modu,Chế Độ Hiển Thị,Mode d'affichage,Anzeigemodus,Modalità di visualizzazione,Режим отображения,Modo de Exibição,โหมดแสดงผล,Mod Paparan,وضع العرض
分辨率,Resolution,,,,解析度,해상도,解像度,Upplösning,Rozdzielczość,Resolutie,Resolusi,Resolución,Çözünürlük,Độ Phân Giải,Résolution,Auflösung,Risoluzione,Разрешение,Resolução,ความละเอียด,Resolusi,الدقة
性能设置,Performance Settings,,,,效能設定,성능 설정,パフォーマンス設定,Prestandainställningar,Ustawienia wydajności,Prestatie-instellingen,Pengaturan Performa,Ajustes de rendimiento,Performans Ayarları,Cài Đặt Hiệu Suất,Paramètres de performance,Leistungseinstellungen,Impostazioni prestazioni,Настройки производительности,Configurações de Desempenho,การตั้งค่าประสิทธิภาพ,Tetapan Prestasi,إعدادات الأداء
客服帮助,Customer Support,,,,客服幫助,고객센터 도움,カスタマーサポート,Kundtjänst,Obsługa klienta,Klantenservice,Dukungan Pelanggan,Atención al cliente,Müşteri Desteği,Hỗ Trợ Khách Hàng,Service client,Kundensupport,Assistenza clienti,Служба поддержки,Atendimento ao Cliente,ฝ่ายสนับสนุนลูกค้า,Sokongan Pelanggan,دعم العملاء
强敌来袭！,Incoming Enemies!,,,,強敵來襲！,강적 출현!,強敵来襲！,Inkommande fiender!,Nadchodzą wrogowie!,Vijanden in aantocht!,Musuh Datang!,¡Se aproximan enemigos!,Düşmanlar Yaklaşıyor!,Kẻ Địch Đến!,Ennemis en approche !,Feinde im Anmarsch!,Nemici in arrivo!,Враги на подходе!,Inimigos Chegando!,ศัตรูกำลังมา!,Musuh Mendekati!,الأعداء القادمين
托管中断,Auto-Battle Interrupted,,,,自動戰鬥中止,자동 전투 중단,オート処理中断,Autobearbetning avbruten,Automatyczne działanie przerwane,Automatische verwerking onderbroken,Pemrosesan Otomatis Dihalangi,Procesamiento automático interrumpido,Otomatik İşleme Durduruldu,Tự Động Xử Lý Bị Gián Đoạn,Traitement auto interrompu,Auto-Erledigen unterbrochen,Elaborazione automatica interrotta,Авторежим прерван,Processamento Automático Interrompido,การประมวลผลอัตโนมัติถูกขัดจังหวะ,Proses Automatik Terganggu,توقفت المعالجة التلقائية
行商雪莉,Trader Sherry,,,,行商雪莉,트레이더 셰리,行商人シェリー,Handlare Sherry,Handlarz Sherry,Handelaar Sherry,Trader Sherry,Comerciante Sherry,Tüccar Sherry,Thương Nhân Sherry,Sherry la commerçante,Händlerin Sherry,La mercante Sherry,Торговец Шелли,Negociante Sherry,ผู้ค้าเชอร์รี่,Pedagang Sherry,التاجرة شيري
商业大臣杜森,Business Secretary Dussen,,,,商業大臣杜森,비즈니스 대신 두센,貿易大臣デューセム,Affärssekreterare Dussen,Sekretarz handlu Dussen,Bedrijfssecretaris Dussen,Sekretaris Bisnis Dussen,Secretario de negocios Dussen,Ticaret Bakanı Dussen,Thư Ký Kinh Doanh Dussen,Dussen le secrétaire,Handelssekretär Dussen,Il segretario agli Affari Dussen,Министр экономики Дассен,Secretário de Negócios Dussen,เลขานุการฝ่ายธุรกิจ ดัสเซน,Setiausaha Perniagaan Dussen,سكرتير الأعمال دوسين
行商叛徒寇迪克,Trader Traitor Caudic,,,,行商叛徒寇迪克,트레이더 배신자 코딕,裏切りの行商人コーディック,Handlarförrädare Caudic,Zdradziecki handlarz Caudic,Handelsverrader Caudic,Pengkhianat Trader Caudic,Comerciante traidor Caudic,Hain Tüccar Caudic,Kẻ Phản Bội Caudic,Caudic le traître,Verräterischer Händler Caudic,Il mercante traditore Caudic,Предатель Кодик,Negociante Traidor Caudic,ผู้ค้าคอดิกผู้ทรยศ,Pengkhianat Pedagang Caudic,كوديك التاجر الخائن
库仑工业斯威克,Swick from Coulomb Industries,,,,庫侖工業斯威克,클론 산업의 스윅,クーロン社のスウィック,Swick från Coulomb Industri,Swick z Fabryki Kulombów,Swick van Coulomb Industries,Swick dari Industri Coulomb,Swick de Industrias Colombo,Coulomb Endüstrilerinden Swick,Swick từ Tập Đoàn Coulomb,Swick de Coulomb Industries,Swick von Coulomb Industries,Swick delle Coulomb Industries,Свик из «Кулон Индастрис»,Swick das Indústrias Coulomb,สวิคจากคูลอมบ์อินดัสตรี,Swick dari Industri Coulomb,سويك من شركة كولومب للصناعات
