Chinese (Simplified),English,Category,Description,Reference,Chinese (Traditional),Korean,Japanese,Swedish,Polish,Dutch,Indonesian,Spanish,Turkish,Vietnamese,French,German,Italian,Russian,Portuguese,Thai,Malaysian,Arabic
爆破极客宝箱,Blast Geek Chest,Bundle,里里英雄碎片宝箱 | Lily's Fragment Chest,,爆破極客寶箱,폭발 괴짜 보물상자,爆裂エンジニアBOX,Explosionsnördens kista,Skrzynia entuzjastki eksplozji,Explosie-expertkist,Peti Ledakan Geek,Cofre de Geek Explosiva,Patlama Çılgını Sandığı,Rương Chuyên Gia Cháy Nổ,Coffre de la geek de la destruction,Truhe der Pyromanin,Forziere Esperta delle esplosioni,Кейс «Гик-подрывник»,Baú de Geek Explosiva,หีบเซียนระเบิด,Peti Gek Letupan,صندوق مهووسة التفجير
不死传奇宝箱,Living Legend Chest,Bundle,道格英雄碎片宝箱 | Doug's Fragment Chest,,不死傳奇寶箱,불사의 전설 패키지,生ける伝説BOX,Levande legendens kista,Skrzynia żywej legendy,Levende-legendekist,Peti Legenda Hidup,Cofre de Leyenda Viviente,Yaşayan Efsane Sandığı,Rương Huyền Thoại Sống,Coffre de la légende vivante,Truhe der lebenden Legende,Forziere Leggenda vivente,Кейс «Живая легенда»,Baú de Lenda Viva,หีบตำนานที่ยังมีลมหายใจ,Peti Legenda Hidup,صندوق الأسطورة الحية
商会之星宝箱,Star of the Guild Chest,Bundle,,,商會之星寶箱,길드 스타 보물상자,ギルドスターBOX,Gillets stjärna-kista,Skrzynia Gwiazdy Gildii,Ster van het gilde-kist,Bintang Peti Guild,Cofre de la Estrella del gremio,Loncanın Yıldızı Sandığı,Rương Ngôi Sao Thương Hội,Coffre de l'Étoile de la guilde,Stern der Gildentruhe,Forziere Astro della Gilda,Сундук звезды гильдии,Baú da Estrela da Guilda,หีบดาวเด่นแห่งกิลด์,Bintang Peti Persatuan,نجم صندوق النقابة
升级建筑,Upgrade Buildings,Feature,每日任务 | Daily Quest,,建築升級,건물 업그레이드,建物アップグレード,Uppgradera byggnader,Ulepsz budynki,Gebouwen opwaarderen,Upgrade Bangunan,Mejora edificios,Binaları Yükselt,Nâng Cấp Công Trình,Améliorer des bâtiments,Einrichtungen verbessern,Aggiornamento degli edifici,Улучшите сооружения,Melhore Construções.,อัปเกรดอาคาร,Naik Taraf Bangunan,قم بترقية المباني
研发科技,Research Technologies,Feature,每日任务 | Daily Quest,,科技研發,과학 기술 연구,技術研究,Forska om tekniker,Wykonaj badania,Technologieën onderzoeken,Teknologi Riset,Investiga tecnologías,Teknoloji Araştır,Nghiên Cứu Công Nghệ,Rechercher des technologies,Technologien erforschen,Ricerca tecnologie,Исследуйте технологии,Pesquise Tecnologias,วิจัยเทคโนโลยี,Teknologi Penyelidikan,تقنيات البحث
商会互助,Commerce Guild Assistance,Feature,每日任务 | Daily Quest,,商會互助,길드 지원,ギルド支援,Assist från handelsgillet,Pomoc gildii handlowej,Handelsgildehulp,Bantuan Guild Perdagangan,Asiste al gremio de comercio,Ticaret Loncası Yardımlaşması,Hỗ Trợ Thương Hội,Aider la guilde,Gildenunterstützung,Assistenza della Gilda del commercio,Окажите помощь торговой гильдии,Auxilie a Guilda Comercial,การช่วยเหลือสมาคมการค้า,Bantuan Persatuan Perdagangan,مساعدة نقابة التجارة
建造战机,Build Combat Craft,Feature,每日任务 | Daily Quest,,建造戰艦,전투기 건설,戦闘機を建造する,Bygg stridsfarkoster,Zbuduj statek bojowy,Gevechtsschepen bouwen,Bangun Pesawat Tempur,Construye naves de combate,Savaş Gemisi İnşa Et,Xây Chiến Hạm,Fabriquer des vaisseaux de combat,Kampfschiffe bauen,Costruisci navicelle da combattimento,Постройте истребитель,Construa Veículos de Combate,สร้างยานรบ,Bina Pesawat Tempur,بناء مركبة قتالية
折扣商店购买,Purchase in Discount Shop,Feature,每日任务 | Daily Quest,,折扣商店購買,할인 상점 구매,割引ストアで購入,Köp i Rabattbutiken,Kup w Sklepie ze zniżkami,Kopen in kortingswinkel,Beli di Toko Diskon,Compra en la tienda de descuentos,İndirim Mağazasından Satın Al,Mua Hàng trong Cửa Hàng Giảm Giá,Acheter dans le magasin discount,Käufe im Rabatt-Shop,Acquista nel Negozio degli sconti,Купите предмет в магазине со скидками,Compre na Loja de Descontos,ซื้อในร้านค้าส่วนลด,Beli di Kedai Diskaun,اشترِ من متجر الخصومات
招募英雄,Recruit Champions,Feature,每日任务 | Daily Quest,,招募英雄,챔피언 모집,ヒーロー募集,Rekrytera förkämpar,Zrekrutuj czempionów,Kampioenen werven,Rekrut Champion,Recluta campeones,Kahramanları Topla,Chiêu Mộ Tướng,Recruter de champions,Champions rekrutieren,Recluta campioni,Завербуйте защитников,Recrute Campeões,รับสมัครแชมเปี้ยน,Rekrut Pejuang,تجنيد الأبطال
商会捐献,Perform Commerce Guild Donations,Feature,每日任务 | Daily Quest,,商會捐獻,길드 기부,ギルド寄付,Utför donationer till handelsgillet,Przekaż darowizny na gildię handlową,Handelsgildedonaties uitvoeren,Lakukan Donasi Guild Perdagangan,Dona al gremio de comercio,Ticaret Loncası Bağışı Yap,Thực Hiện Quyên Góp Thương Hội,Faire des dons à la ligue,Gildenspenden,Effettua donazioni della Gilda del commercio,Совершите взнос для торговой гильдии,Faça Doações para a Guilda Comercial,บริจาคให้สมาคมการค้า,Beri Sumbangan Persatuan Perdagangan,تبرَّع لنقابة التجارة
征服里程碑解锁礼包,Conquest Milestone Unlock Pack,Bundle,礼包名称 | Pack,,征服里程碑解鎖禮包,정복 마일스톤 해금 패키지,征服マイルストーン解放パック,Erövringspaket för milstolpeupplåsning,Pakiet odblokowania kamienia milowego podboju,Vrijspeelbundel voor veroveringsmijlpaal,Paket Buka Pencapaian Penaklukan,Paquete de desbloqueo de hito de conquista,Fetih Başarım Noktası Kilit Açma Paketi,Gói Mở Khóa Cột Mốc Chinh Phục,Pack de déblocage - Étapes de conquête,Freischaltungspaket für Eroberungsmeilensteine,Pacchetto Sblocco traguardo conquista,Набор для открытия вехи завоевания,Pacote de Desbloqueio do Marco de Conquista,แพ็กปลดล็อกเป้าหมายการพิชิต,Pek Pembukaan Pencapaian Penaklukan,حزمة فتح إنجاز الفتوحات
传奇里程碑解锁礼包,Legendary Milestone Unlock Pack,Bundle,礼包名称 | Pack,,傳奇里程碑解鎖禮包,전설의 이정표 해금 패키지,レジェンダリーマイルストーン解放パック,Legendariskt paket för milstolpeupplåsning,Pakiet odblokowania legendarnego kamienia milowego,Vrijspeelbundel voor legendarische mijlpaal,Paket Buka Pencapaian Legendaris,Paquete de desbloqueo de hito legendario,Efsanevi Başarım Noktası Kilit Açma Paketi,Gói Mở Khóa Cột Mốc Huyền Thoại,Pack de déblocage - Étapes légendaires,Legendäres Meilenstein-Freischaltungspaket,Pacchetto Sblocco traguardo leggendario,Набор для открытия легенд. вехи,Pacote de Desbloqueio do Marco Lendário,แพ็กปลดล็อกเป้าหมายตำนาน,Pakej Pembukaan Penanda Aras Lagenda,حزمة فتح الإنجاز الأسطوري
活跃里程碑升级礼包,Active Milestone Upgrade Pack,Bundle,礼包名称 | Pack,,活躍里程碑升級禮包,활약 마일스톤 업그레이드 패키지,アクティブマイルストーン パック,Aktivt paket för milstolpeuppgradering,Pakiet ulepszenia aktywnego kamienia milowego,Opwaardeerbundel voor actieve mijlpaal,Paket Upgrade Pencapaian Aktif,Paquete de mejora de hito activo,Aktif Başarım Noktası Yükseltme Paketi,Gói Nâng Cấp Cột Mốc Hoạt Động,Pack de déblocage - Étapes actives,Verbesserungspaket für aktive Meilensteine,Pacchetto Potenziamento traguardo attivo,Набор для улучшения активной вехи,Pacote de Melhoria do Marco Ativo,แพ็กอัปเกรดเป้าหมายที่ดำเนินอยู่,Pakej Peningkatan Penanda Aras Aktif,حزمة ترقية الإنجاز النشط
里程点,Milestone Points,Item,通过活跃任务进度奖励获取 | Earned through Active Quests progress rewards,,里程點,마일스톤 포인트,マイルストーンポイント,Milstolpepoäng,Punkty kamienia milowego,Mijlpaalpunten,Poin Pencapaian,Puntos de hito,Başarım Noktası Puanları,Điểm Cột Mốc,Points d'étape,Meilensteinpunkte,Punti traguardo,Очки вехи,Pontos de Marco,คะแนนเป้าหมาย,Mata Pencapaian,نقاط الإنجاز
动能过载,Kinetic Overload,Name,Buff,,動能過載,키네틱 과부하,実弾オーバーロード,Kinetisk överladdning,Przeciążenie kinetyczne,Kinetische overbelasting,Kinetic Overload,Sobrecarga cinética,Kinetik Aşırı Yükleme,Quá Tải Động Năng,Surcharge cinétique,Kinetik-Überlastung,Sovraccarico cinetico,Кинетическая перегрузка,Sobrecarga Cinética,โอเวอร์โหลดคิเนติก,Beban Lebih Kinetik,التحميل الزائد الحركي
光束同调,Beam Sync,Name,Buff,,光束同調,빔 동기화,ビーム共鳴,Strålsynk,Synchronizacja laserowa,Straalsynchronisatie,Beam Sync,Sincronía de rayo,Işın Senkronizasyonu,Đồng Bộ Quang Tiễn,Sync de faisceau,Strahlen-Synchronisation,Sincronizzazione raggio,Фотонная синхронизация,Sincronização de Rajada,ซิงค์ลำแสง,Penyegerakan Pancaran,المزامنة الشعاعية
离子共鸣,Ion Resonance,Name,Buff,,離子共鳴,이온 공명,イオン共鳴,Jonresonans,Rezonans jonowy,Ionresonantie,Ion Resonance,Resonancia de ion,İyon Rezonansı,Cộng Hưởng Ion,Résonance ionique,Ionenresonanz,Risonanza ionica,Ионный резонанс,Ressonância Iônica,ไอออนประสาน,Resonans Ion,رنين الأيون
发财红包,Prosperity Bounty,Bundle,,,發財紅包,행운의 보상,ギフト,Välståndsskatt,Nagroda dobrobytu,Welvaartspremie,Imbalan Kemakmuran,Recompensa de Prosperidad,Refah Ödülü,Bao Lì Xì Phồn Vinh,Prime de prospérité,Wohlstandsgabe,Ricompensa della prosperità,Награда процветания,Prêmio da Prosperidade,ค่าหัวแห่งความรุ่งเรือง,Ganjaran Kemakmuran,جائزة الازدهار
好运红包,Fortune Bounty,Bundle,,,好運紅包,행운의 보상,フォーチュンギフト,Lyckoskatt,Nagroda fortuny,Fortuinpremie,Imbalan Keberuntungan,Recompensa de Fortuna,Talih Ödülü,Bao Lì Xì Vận May,Prime de fortune,Glücksgabe,Ricompensa della fortuna,Награда удачи,Prêmio da Fortuna,ค่าหัวแห่งโชคลาภ,Ganjaran Tuah,مكافأة الحظ
宇宙红包,Space Bounty,Bundle,,,宇宙紅包,우주 보상,宇宙ギフト,Universumskatt,Nagroda Wszechświata,Universumpremie,Imbalan Semesta,Recompensa del universo,Evren Ödülü,Tiền Thưởng Vũ Trụ,Primes de l'univers,Universum-Gabe,Ricompensa dell'Universo,Вселенская награда,Prêmio do Universo,ค่าหัวจักรวาล,Ganjaran Alam Semesta,جائزة العالم
区域红包,Region Bounty,Bundle,,,區域紅包,구역 보상,エリアギフト,Regionsskatt,Nagroda regionu,Regiopremie,Imbalan Wilayah,Recompensa regional,Bölge Ödülü,Bao Lì Xì Khu Vực,Prime régionale,Regionengabe,Ricompensa della regione,Награда региона,Prêmio da Região,ค่าหัวภูมิภาค,Ganjaran Rantau,مكافأة المنطقة
商会红包,Guild Bounty,Bundle,,,商會紅包,길드 보상,ギルドのギフト,Gilleskatt,Nagroda gildii,Gildepremie,Imbalan Guild,Recompensa del gremio,Lonca Ödülü,Bao Lì Xì Thương Hội,Prime de la guilde,Gildengabe,Ricompensa della gilda,Награда гильдии,Prêmio da Guilda,ค่าหัวสมาคม,Ganjaran Persatuan,جائزة النقابة
物资自选礼包,Supply Choice Pack,Bundle,,,物資自選禮包,물자 선택 패키지,物資選択パック,Valpaket med resurser,Pakiet zaopatrzenia do wyboru,Voorraadkeuzepakket,Paket Pilihan Pasokan,Paquete de selección de suministros,Seçmeli İkmal Paketi,Gói Vật Tư Tùy Chọn,Pack d'approvisionnement au choix,Vorratsauswahlpaket,Pacchetto scelta dei rifornimenti,Набор припасов на выбор,Pacote de Escolha de Suprimentos,แพ็กเลือกเสบียง,Pek Pilihan Bekalan,حزمة اختيار الإمدادات
托管战斗,Auto-Process,Feature,,,自動戰鬥,자동 전투,オート戦闘,Autobearbetning,Automatyczne działanie,Automatische verwerking,Proses Otomatis,Procesamiento automático,Otomatik İşleme,Tự Động Xử Lý,Traitement auto,Auto-Erledigen,Elaborazione automatica,Авторежим,Processamento Automático,ประมวลผลอัตโนมัติ,Proses Automatik,المعالجة التلقائية
自动战斗,Auto-Battle,Feature,,,自動戰鬥,자동 전투,オート戦闘,Auto-strid,Autom. walka,Automatisch gevecht,Auto-Pertarungan,Batalla automática,Otomatik Savaş,Chiến Đấu Tự Động,Combat auto,Auto-Kampf,Battaglia automatica,Автобой,Batalha Automática,ต่อสู้อัตโนมัติ,Auto Tempur,القتال التلقائي
游击战,Skirmish,Name,,,游擊戰,유격전,遊撃戦,Drabbning,Potyczka,Schermutseling,Bentrokan,Escaramuza,Çatışma,Đụng Độ,Escarmouche,Scharmützel,Schermaglia,Схватка,Escaramuça,ตะลุมบอน,Pertempuran Kecil,مواجهة سريعة
决斗,Duel,Name,,,決鬥,결투,デュエル,Duell,Pojedynek,Duel,Duel,Duelo,Düello,Đối Đầu,Duel,Duell,Duello,Поединок,Duelo,ดวล,Pertarungan,المبارزة
大团战,Group Fight,Name,,,大團戰,대규모 전투,大規模戦闘,Gruppstrid,Walka grupowa,Groepsgevecht,Pertarungan Grup,Combate en grupo,Grup Savaşı,Đấu Nhóm,Combat de groupe,Gruppenkampf,Combattimento di gruppo,Групповая битва,Luta em Grupo,ต่อสู้เป็นกลุ่ม,Perlawanan Berkumpulan,القتال الجماعي
营救友军,Rescue Operation,Name,,,營救友軍,아군 구출,救出作戦,Räddningsoperation,Operacja ratunkowa,Reddingsoperatie,Operasi Penyelamatan,Operación de rescate,Kurtarma Operasyonu,Chiến Dịch Giải Cứu,Opération de sauvetage,Rettungsoperation,Operazione di soccorso,Спасательная операция,Operação de Resgate,ปฏิบัติการกู้ภัย,Operasi Menyelamat,عملية الإنقاذ
坚守不败,The Last Stand,Name,,,堅守不滅,최후의 항전,難攻不落,Mot alla odds,Ostateczne starcie,Eliminatiegevecht,Perlawanan Terakhir,La Última resistencia,Son Direniş,Quyết Chiến Đến Cùng,Ultime combat,Die letzte Bastion,L'ultima resistenza,Последний рубеж,A Última Resistência,การยืนหยัดครั้งสุดท้าย,Pertahanan Terakhir,المواجهة الأخيرة
限时击杀,Timed Kill,Name,,,限時擊殺,기간 한정 처치,タイムリミット討伐,Eliminering mot klockan,Walka na czas,Tijdsgevecht,Kill Terjadwal,Eliminación cronometrada,Süreli İmha,Tiêu Diệt Theo Giờ,Élimination chronométrée,Unter Zeitdruck,Uccisione a tempo,Убийство на время,Eliminação Cronometrada,สังหารตามเวลา,Pembunuhan Bermasa,قتل بمهلة زمنية
太空战,Space Combat,Name,,,太空戰,우주전,宇宙戦,Rymdstrid,Walka w kosmosie,Ruimtegevecht,Pertarungan Ruang Angkasa,Combate espacial,Uzay Savaşı,Chiến Đấu Ngoài Không Gian,Combat spatial,Weltraumkampf,Combattimento spaziale,Космическая битва,Combate Espacial,การต่อสู้ในอวกาศ,Pertempuran Angkasa,القتال في الفضاء
登陆战,Ground Assault,Name,,,登陸戰,상륙전,上陸作戦,Markanfall,Atak naziemny,Grondaanval,Serangan Darat,Asalto terrestre,Kara Taarruzu,Tấn Công Trên Mặt Đất,Assaut terrestre,Bodenoffensive,Assalto a terra,Наземная битва,Assalto Terrestre,การโจมตีภาคพื้นดิน,Serangan Darat,الهجوم على الأرض
营救行动,Rescue Operation,Name,,,營救行動,구출 작전,救出作戦,Räddningsoperation,Operacja ratunkowa,Reddingsoperatie,Operasi Penyelamatan,Operación de rescate,Kurtarma Operasyonu,Chiến Dịch Giải Cứu,Opération de sauvetage,Rettungsoperation,Operazione di soccorso,Спасательная операция,Operação de Resgate,ปฏิบัติการกู้ภัย,Operasi Menyelamat,عملية الإنقاذ
挑战强敌,A Formidable Foe,Name,,,挑戰強敵,강적에 도전,強敵に挑戦,En mäktig fiende,Groźny przeciwnik,Een geduchte tegenstander,Musuh yang Tangguh,Un enemigo formidable,Yaman Düşman,Kẻ Địch Đáng Gờm,Un adversaire redoutable,Ein würdiger Gegner,Un nemico formidabile,Серьезный противник,Um Inimigo Formidável,ศัตรูที่น่าเกรงขาม,Musuh yang Hebat,عدو لدود
清算叛徒,Eliminate the Traitor,Name,,,清算叛徒,반역자 숙청,裏切り者の粛清,Eliminera förrädaren,Zabij zdrajcę,Elimineer de verrader,Singkirkan si Pengkhianat,Eliminar al traidor,Haini Yok Et,Tiêu Diệt Kẻ Phản Bội,Éliminer le traître,Eliminiere den Verräter,Elimina il traditore,Ликвидация предателя,Elimine o Traidor,กำจัดคนทรยศ,Singkirkan Pengkhianat,إزالة الخائن
战利收缴,Gather the Trophy,Name,,,戰利收取,전리품 징수,戦利品回収,Hämta trofén,Zgarnij trofeum,Claim de trofee,Kumpulkan Tanda Kemenangan,Reunir el Trofeo,Ganimeti Topla,Thu Thập Cúp,Récupérer le trophée,Sammle die Trophäe,Ottieni il trofeo,Сбор трофеев,Colete o Troféu,รวบรวมถ้วยรางวัล,Kumpulkan Trofi,احصل على الجائزة
训练手册,Training Manual,Item,,,訓練手冊,훈련 매뉴얼,訓練マニュアル,Träningsmanual,Podręcznik szkoleniowy,Trainingshandleiding,Manual Pelatihan,Manual de entrenamiento,Eğitim Kılavuzu,Sổ Tay Huấn Luyện,Manuel d'entraînement,Trainingshandbuch,Manuale di addestramento,Учебное пособие,Manual de Treinamento,คู่มือการฝึก,Manual Latihan,دليل التدريب
中控能核（动能）,Control Cube (Kinetic),Name,普通旗舰部件 | Basic Flagship Component,,中控能核（動能）,중앙 제어 에너지 코어 (키네틱),中枢制御コア（実弾）,Kontrollkub (kinetisk),Kostka kontrolna (kinetyczna),Controlekubus (kinetisch),Kubus Kontrol (Kinetic),Cubo de control (cinética),Kontrol Küpü (Kinetik),Khối Điều Khiển (Động Năng),Cube de contrôle (cinétique),Kontrollwürfel (Kinetik),Cubo di controllo (Cinetico),Управляющий куб (кинетика),Cubo de Controle (Cinético),ลูกบาศก์ควบคุม (คิเนติก),Kiub Kawalan (Kinetik),مكعب التحكم (حركي)
轨道炮（动能）,Railgun (Kinetic),Name,普通旗舰部件 | Basic Flagship Component,,軌道炮（動能）,궤도포 (키네틱),レールガン（実弾）,Magnetkanon (kinetiskt),Działo elektromagnetyczne (kinetyczne),Railgun (kinetisch),Senapan Rel (Kinetic),Cañón de riel (cinética),Raylı Top (Kinetik),Pháo Điện Từ (Động Năng),Canon électrique (cinétique),Railgun (Kinetik),Cannone a rotaia (Cinetico),Рельсотрон (кинетика),Canhão Móvel (Cinético),ปืนแม่เหล็กไฟฟ้า (คิเนติก),Meriam Rel (Kinetik),المدفع الكهرومغناطيسي (حركي)
全域雷达（动能）,Omni Radar (Kinetic),Name,普通旗舰部件 | Basic Flagship Component,,全域雷達（動能）,전역 레이더 (키네틱),全域レーダー（実弾）,Omniradar (kinetiskt),Radar szerokiego zasięgu (kinetyczny),Omni-radar (kinetisch),Radar Omni (Kinetic),Omniradar (cinética),Omni Radar (Kinetik),Ra-đa Toàn Diện (Động Năng),Radar omnidirectionnel (cinétique),Omni-Radar (Kinetik),Omni-radar (Cinetico),Омнирадар (кинетика),Radar Omni (Cinético),เรดาร์อเนกประสงค์ (คิเนติก),Radar Omni (Kinetik),الرادار الشامل (الحركي)
复合装甲（动能）,Composite Armor (Kinetic),Name,普通旗舰部件 | Basic Flagship Component,,複合裝甲（動能）,복합 아머 (키네틱),複合装甲（実弾）,Kompositpansar (kinetiskt),Pancerz kompozytowy (kinetyczny),Composietpantser (kinetisch),Armor Komposit (Kinetic),Blindaje compuesto (cinética),Kompozit Zırh (Kinetik),Giáp Hợp Kim (Động Năng),Blindage composite (cinétique),Verbundpanzerung (Kinetik),Armatura composita (Cinetico),Композитная броня (кинетика),Armadura Composta (Cinético),เกราะคอมโพสิต (คิเนติก),Perisai Komposit (Kinetik),الدرع المركّبة (الحركي)
推进器（动能）,Thruster (Kinetic),Name,普通旗舰部件 | Basic Flagship Component,,動能推進器,추진기 (키네틱),スラスター（実弾）,Manövreringsmotor (kinetisk),Pędnik (kinetyczny),Stuwmotor (kinetisch),Thruster (Kinetic),Propulsor (cinética),İtici (Kinetik),Động Cơ Đẩy (Động Năng),Propulseur (cinétique),Triebwerk (Kinetik),Propulsore (Cinetico),Ускоритель (кинетика),Propulsor (Cinético),ทรัสเตอร์ (คิเนติก),Penujah (Kinetik),محرك الدفع (الحركي)
中控能核（光束）,Control Cube (Beam),Name,普通旗舰部件 | Basic Flagship Component,,中控能核（光束）,중앙 제어 에너지 코어 (빔),中枢制御コア（ビーム）,Kontrollkub (stråle),Kostka kontrolna (laserowa),Controlekubus (straal),Kubus Kontrol (Beam),Cubo de control (rayo),Kontrol Küpü (Işın),Khối Điều Khiển (Quang Tiễn),Cube de contrôle (faisceau),Kontrollwürfel (Strahlen),Cubo di controllo (Raggio),Управляющий куб (фотон),Cubo de Controle (Rajada),ลูกบาศก์ควบคุม (ลำแสง),Kiub Kawalan (Pancaran),مكعب التحكم (الشعاعي)
轨道炮（光束）,Railgun (Beam),Name,普通旗舰部件 | Basic Flagship Component,,軌道炮（光束）,궤도포 (빔),レールガン（ビーム）,Magnetkanon (stråle),Działo elektromagnetyczne (laserowe),Railgun (straal),Senapan Rel (Beam),Cañón de riel (rayo),Raylı Top (Işın),Pháo Điện Từ (Quang Tiễn),Canon électrique (faisceau),Railgun (Strahlen),Cannone a rotaia (Raggio),Рельсотрон (фотон),Canhão Móvel (Rajada),ปืนแม่เหล็กไฟฟ้า (ลำแสง),Meriam Rel (Pancaran),مدفع كهرومغناطيسي (شعاع)
全域雷达（光束）,Omni Radar (Beam),Name,普通旗舰部件 | Basic Flagship Component,,全域雷達（光束）,전역 레이더 (빔),全域レーダー（ビーム）,Omniradar (stråle),Radar szerokiego zasięgu (laserowy),Omni-radar (straal),Radar Omni (Beam),Omniradar (rayo),Omni Radar (Işın),Ra-đa Toàn Diện (Quang Tiễn),Radar omnidirectionnel (faisceau),Omni-Radar (Strahlen),Omni-radar (Raggio),Омнирадар (фотон),Radar Omni (Rajada),เรดาร์อเนกประสงค์ (ลำแสง),Radar Omni (Pancaran),الرادار الشامل (الشعاعي)
复合装甲（光束）,Composite Armor (Beam),Name,普通旗舰部件 | Basic Flagship Component,,複合裝甲（光束）,복합 아머 (빔),複合装甲（ビーム）,Kompositpansar (stråle),Pancerz kompozytowy (laserowy),Composietpantser (straal),Armor Komposit (Beam),Blindaje compuesto (rayo),Kompozit Zırh (Işın),Giáp Hợp Kim (Quang Tiễn),Blindage composite (faisceau),Verbundpanzerung (Strahlen),Armatura composita (Raggio),Композитная броня (фотон),Armadura Composta (Rajada),เกราะคอมโพสิต (ลำแสง),Perisai Komposit (Pancaran),الدرع المركّبة (الشعاع)
推进器（光束）,Thruster (Beam),Name,普通旗舰部件 | Basic Flagship Component,,光束推進器,추진기 (빔),スラスター（ビーム）,Manövreringsmotor (stråle),Pędnik (laserowy),Stuwmotor (straal),Thruster (Beam),Propulsor (rayo),İtici (Işın),Động Cơ Đẩy (Quang Tiễn),Propulseur (faisceau),Triebwerk (Strahlen),Propulsore (Raggio),Ускоритель (фотон),Propulsor (Rajada),ทรัสเตอร์ (ลำแสง),Penujah (Pancaran),محرك الدفع (الشعاع)
中控能核（离子）,Control Cube (Ion),Name,普通旗舰部件 | Basic Flagship Component,,中控能核（離子）,중앙 제어 에너지 코어 (이온),中枢制御コア（イオン）,Kontrollkub (jon),Kostka kontrolna (jonowa),Controlekubus (ionisch),Kubus Kontrol (Ion),Cubo de control (ión),Kontrol Küpü (İyon),Khối Điều Khiển (Ion),Cube de contrôle (ionique),Kontrollwürfel (Ionen),Cubo di controllo (Ionico),Управляющий куб (ион),Cubo de Controle (Iônico),ลูกบาศก์ควบคุม (ไอออน),Kiub Kawalan (Ion),مكعب التحكم (أيوني)
