Chinese (Simplified),English,Category,Description,Reference,Chinese (Traditional),Korean,Japanese,Swedish,Polish,Dutch,Indonesian,Spanish,Turkish,Vietnamese,French,German,Italian,Russian,Portuguese,Thai,Malaysian,Arabic
基地：银河纵横,Foundation: Galactic Frontier,Confirmed,游戏名 | Game Name,,基地：星界無間,파운데이션: 우주 전선,ファウンデーション：銀河フロンティア,Foundation: Galactic Frontier,Foundation: Galactic Frontier,Foundation: Galactic Frontier,Foundation: Galactic Frontier,Fundación: frontera galáctica,Foundation: Galactic Frontier,Foundation: Galactic Frontier,Foundation: Galactic Frontier,Foundation: Galactic Frontier,Fondazione: Frontiera galattica,Foundation: Galactic Frontier,Fundação: Fronteira Galáctica,Foundation: Galactic Frontier,Foundation: Galactic Frontier,Foundation: Galactic Frontier
采集,Salvage,Feature,,,採集,채집,採集,Bärgning,Odzyskiwanie,Berging,Penyelamatan,Recuperación,Kurtarma,Thu Nhặt,Récupération,Bergen,Recupera,Добыча,Coleta,เก็บกู้,Kutipan,إنقاذ
采集奖励,Salvage Reward,Name,,,採集獎勵,채집 보상,採集報酬,Bärgningsbelöning,Nagroda za odzyskiwanie,Bergingsbeloning,Hadiah Penyelamatan,Recompensa de recuperación,Kurtarma Ödülü,Phần Thưởng Thu Nhặt,Récompense de récupération,Bergungsbelohnung,Ricompensa recupero,Награды за добычу,Recompensa de Coleta,รายงานการเก็บกู้,Ganjaran Kutipan,مكافأة الغنائم
超级宝箱,Super Chest,Bundle,,,超級寶箱,초월 보물상자,スーパーBOX,Superkista,Superskrzynia,Superkist,Peti Super,Supercofre,Süper Sandık,Rương Bất Ngờ,Super coffre,Supertruhe,Forziere prezioso,Суперкейс,Super Baú,หีบเด็คยอด,Peti Super,الصندوق الفائق
迭代,Promote,Name,,,迭代,개편,プロモート,Befordra,Awansuj,Promoveren,Promosikan,Ascender,Terfi Ettir,Thăng Cấp,Promouvoir,Befördern,Promuovi,Повысить,Promover,เลื่อนขั้น,Tingkatkan,الترقية
对决日,Duel Day,Event,,,對決日,결전의 날,対決の日,Duelldag,Dzień pojedynku,Dueldag,Hari Duel,Día del duelo,Düello Günü,Ngày Đối Đầu,Journée de duel,Duelltag,Giorno del duello,День поединка,Dia do Duelo,วันดวล,Hari Pertarungan,يوم المبارزة
对决战场,Battlefield Showdown,Event,商会对决所在地 | Commerce Guild Duel Battlefield,,對決戰場,결전 전투장,対決アリーナ,Uppgörelse på slagfältet,Starcie Pola Bitwy,Slagveldconfrontatie,Pertarungan Medan Tempur,Enfrentamiento en el campo de batalla,Savaş Alanı Hesaplaşması,Quyết Đấu Chiến Địa,Confrontation du champ de bataille,Schlachtfeld-Finale,Scontro sul campo di battaglia,Сражение на поле боя,Confronto no Campo de Batalha,การประลองยุทธ์ในสมรภูมิรบ,Pertarungan Medan Pertempuran,المواجهة في ساحة المعركة
对抗赛,Clash,Event,商会对抗赛 | Commerce Guild Clash,,對抗賽,대항전,対抗戦,Batalj,Starcie,Confrontatie,Bentrokan,Enfrentamiento,Çatışma,Trận Đối Đầu,Affrontement,Konflikt,Scontro,Поединок,Confronto,ปะทะ,Pertembungan,الاشتباك
飞船残骸,Combat Craft Debris,Name,商会中多人共同挖掘的残骸名称 | One of the debris excavated by the Guild,,飛船殘骸,함선 잔해,艦船残骸,Rester av stridsfarkost,Odłamek statku bojowego,Gevechtsschippuin,Puing Pesawat Tempur,Escombros de nave de combate,Savaş Gemisi Enkazı,Mảnh Vụn Chiến Hạm,Débris de vaisseau de combat,Kampfschifftrümmer,Rottami della navicella da combattimento,Обломки истребителя,Destroços do Veículo de Combate,เศษซากยานรบ,Serpihan Pesawat Tempur,حطام المركبات القتالية
护盾,Shield,Name,,,護盾,실드,シールド,Sköld,Tarcza,Schild,Perisai,Escudo,Kalkan,Khiên,Bouclier,Schild,Scudo,Щит,Escudo,โล่,Perisai,الدرع
今日对决,Today's Duel,Event,,,今日對決,일일 결투,本日の対決,Dagens duell,Pojedynek na dzisiaj,Duel van vandaag,Duel Hari Ini,Duelo de hoy,Bugünün Düellosu,Trận Đối Đầu Hôm Nay,Duel du jour,Heutiges Duell,Duello di oggi,Поединок дня,Duelo de Hoje,การดวลวันนี้,Pertarungan Hari Ini,مبارزة اليوم
今日奖励,Today's Rewards,Name,,,今日獎勵,일일 보상,デイリー報酬,Dagens belöningar,Nagrody na dzisiaj,Beloningen van vandaag,Hadiah Hari Ini,Recompensas de hoy,Bugünün Ödülleri,Phần Thưởng Hôm Nay,Récompenses du jour,Heutige Belohnungen,Ricompense di oggi,Награды дня,Recompensas de Hoje,รางวัลวันนี้,Ganjaran Hari Ini,مكافآت اليوم
基础建设,Infrastructure Development,Feature,,,基礎建設,기본 건설,基盤整備,Utveckling av infrastruktur,Rozwój infrastruktury,Infrastructuurontwikkeling,Pengembangan Infrastruktur,Desarrollo de infraestructura,Altyapı Gelişimi,Phát Triển Cơ Sở Hạ Tầng,Développement de l'infrastructure,Infrastrukturentwicklung,Sviluppo infrastruttura,Развитие инфраструктуры,Desenvolvimento de Infraestrutura,การพัฒนาโครงสร้างพื้นฐาน,Pembangunan Infrastruktur,تطوير البنية التحتية
扩军备战,Military Expansion,Feature,,,擴軍備戰,전력 확장,軍備拡張,Militär expansion,Ekspansja militarna,Militaire uitbreiding,Ekspansi Militer,Expansión militar,Askeri Büyüme,Tăng Cường Quân Đội,Expansion militaire,Militärische Expansion,Espansione militare,Военная экспансия,Expansão Militar,การขยายกำลังทหาร,Peluasan Tentera,التوسع العسكري
联合采集,Joint Salvage,Feature,,,聯合採集,공동 채집,共同採集,Samarbetsbärgning,Wspólne Odzyskiwanie,Gezamenlijke berging,Penyelamatan Bersama,Recuperación conjunta,Ortak Kurtarma,Thu Nhặt Chung,Récupération en groupe,Gemeinsame Bergung,Recupero di squadra,Совместная добыча,Coleta Conjunta,เก็บกู้ร่วม,Kutipan Bersama,الإنقاذ المشترك
诺维斯生命科技,Novis LifeTech,Name,,,諾維斯生命科技,노비스 생명공학,ノヴィスライフテック,Novis LivTeknik,Novis LifeTech,Novis LifeTech,Biotek Novis,Novis Biotecnología,Novis Yaşam Teknolojileri,Novis LifeTech,Novis Biotech,Novis Biotechnologie,TecnoVita Novis,Новис Лайфтех,Novis Biotech,โนวิส ไลฟ์เทค,Novis LifeTech,نوفيس لايف تك
培养人才,Talent Nurturing,Feature,,,培養人才,인재 양성,人材育成,Talangutveckling,Rozwijanie talentów,Talentontwikkeling,Pengembangan Bakat,Educación de talentos,Yetenek Yetiştirme,Nuôi Dưỡng Tài Năng,Développement des talents,Talentpflege,Coltivazione dei talenti,Воспитание талантов,Desenvolvimento de Talentos,การบ่มเพาะผู้มีความสามารถ,Asuhan Bakat,تنمية المواهب
全面冲刺,All-Out Sprint,Feature,,,全面衝刺,전력 질주,総力戦,Full sprint,Pełen sprint,Volle sprint,Lari Cepat Habis-Habisan,Carrera sin cuartel,Tüm Hızla Koşu,Tăng Tốc Toàn Diện,Sprint à tout va,Vollgas geben,Sprint completo,Максимальное ускорение,Corrida Total,วิ่งสุดพลัง,Pecutan Habis-habisan,اندفاع كامل
商会对决,Commerce Guild Duel,Event,,,商會對決,길드 대결,ギルド対決,Handelsgilleduellen,Pojedynek Gildii Handlowych,Handelsgildeduel,Duel Guild Perdagangan,Duelo de gremios de comercio,Ticaret Loncası Düellosu,Thương Hội Đối Đầu,Duel des guildes du commerce,Händlergilden-Duell,Duello della Gilda del commercio,Поединок торговых гильдий,Duelo da Guilda Comercial,การดวลสมาคมการค้า,Pertarungan Persatuan Perdagangan,مبارزة نقابة التجارة
声望,Reputation,Feature,,,聲望,명성,名声,Rykte,Reputacja,Reputatie,Reputasi,Reputación,İtibar,Danh Tiếng,Réputation,Ruf,Reputazione,Репутация,Reputação,ชื่อเสียง,Reputasi,السمعة
随机加速宝箱,Random Speedup Chest,Bundle,,,隨機加速寶箱,랜덤 가속 보물상자,ランダムブーストBOX,Slumpkista med påskyndare,Skrzynia z losowym przyspieszeniem,Kist met willekeurige versnellers,Peti Percepatan Acak,Cofre de aceleración aleatoria,Rastgele Hızlandırma Sandığı,Rương Tăng Tốc Ngẫu Nhiên,Coffre aléatoire d'accélération,Zufällige Beschleunigungstruhe,Forziere accelerazione casuale,Случайный кейс: ускорители,Baú de Aceleração Aleatório,หีบเร่งความเร็วแบบสุ่ม,Peti Pencepat Rawak,صندوق التسريع العشوائي
随机旗舰部件宝箱,Random Flagship Component Chest,Bundle,,,隨機旗艦組件寶箱,랜덤 군함 부품 보물상자,ランダム旗艦パーツBOX,Slumpkista med flaggskeppskomponent,Skrzynia z losowym komponentem okrętu flagowego,Kist met willekeurige vlaggenschipcomponent,Peti Komponen Flagship Acak,Cofre de componente de nave insignia aleatorio,Rastgele Amiral Gemisi Bileşen Sandığı,Rương Bộ Phận Soái Hạm Ngẫu Nhiên,Composant aléatoire de vaisseau amiral,Zufällige Flaggschiffkomponenten-Truhe,Forziere componente ammiraglia casuale,Случайный кейс: компоненты флагмана,Baú de Componente de Nau Capitânia Aleatório,หีบชิ้นส่วนยานเรือธงแบบสุ่ม,Peti Komponen Kapal Laksamana Rawak,صندوق مكونات سفينة القيادة العشوائي
随机信用点宝箱,Random Credit Chest,Bundle,,,隨機信用點寶箱,랜덤 신용 포인트 보물상자,ランダムクレジットBOX,Slumpkista med krediter,Skrzynia losu z kredytami,Kist met willekeurige credits,Peti Kredit Acak,Cofre de créditos aleatorio,Rastgele Kredi Sandığı,Rương Điểm Tín Dụng Ngẫu Nhiên,Coffre aléatoire de crédits,Zufällige Credit-Truhe,Forziere credito casuale,Случайный кейс: кредиты,Baú de Crédito Aleatório,หีบเครดิตแบบสุ่ม,Peti Kredit Rawak,صندوق نقاط الرصيد العشوائي
随机银河币宝箱,Random Galactic Coin Chest,Bundle,,,隨機銀河幣寶箱,랜덤 갤럭시 코인 보물상자,ランダムギャラクシーコインBOX,Slumpkista med galaktiskt mynt,Skrzynia losu z monetami galaktycznymi,Kist met willekeurige galactische munten,Peti Koin Galactic Acak,Cofre aleatorio de monedas galácticas,Rastgele Galaktik Para Sandığı,Rương Xu Thiên Hà Ngẫu Nhiên,Coffre aléatoire de pièces galactiques,Zufällige Galaxiemünze-Truhe,Forziere moneta galattica casuale,Случайный кейс: галактические монеты,Baú Aleatório de Moedas Galácticas,หีบเหรียญกาแล็กซีแบบสุ่ม,Peti Syiling Galaksi Rawak,صندوق عملات المجرة العشوائي
天选之人,The Chosen One,Name,,,天選之人,선택받은 자,選ばれし者,Den utvalda,Wybraniec,De uitverkorene,Yang Terpilih,El elegido,Seçilmiş Kişi,Người Được Chọn,L'élu,Der Auserwählte,Il prescelto,Избранный,O Escolhido,ผู้ถูกเลือก,Insan Terpilih,المختار
涂装,Paint Job,Name,旗舰皮肤 | Appearance of Flagship,,塗裝,도장,ペイント,Lackering,Lakier,Lakwerk,Cat,Pintura,Boya,Màu,Peinture,Lackierung,Verniciatura,Покрытие,Pintura,งานสี,Cat,تصميم الطلاء
未知随机奖励宝箱,Unknown Random Reward Chest,Bundle,,,未知隨機獎勵寶箱,미지의 랜덤 보상 보물상자,ミステリーBOX,Slumpkista med okänd belöning,Skrzynia z losową nagrodą,Kist met onbekende willekeurige beloning,Peti Hadiah Acak Tak Diketahui,Cofre de recompensa aleatoria desconocida,Bilinmeyen Rastgele Ödül Sandığı,Rương Phần Thưởng Ngẫu Nhiên Bí Ẩn,Coffre aléatoire de récompenses inconnues,Unbekannte zufällige Belohnungstruhe,Forziere ricompensa casuale sconosciuto,Случайный кейс: награды,Baú de Recompensa Aleatória Desconhecida,หีบรางวัลแบบสุ่มที่ไม่รู้จัก,Peti Ganjaran Rawak Tidak Diketahui,صندوق مكافآت عشوائية مجهول
星舰与太阳,Spaceship and Sun,Event,活动名称 | Event,,星艦與太陽,함선과 태양,星艦と太陽,Rymdskepp och sol,Statek i Słońce,Ruimteschip en Zon,Kapal Luar Angkasa dan Matahari,Nave espacial y sol,Uzay Gemisi ve Güneş,Phi Thuyền và Mặt Trời,Vaisseau spatial et soleil,Das Raumschiff und die Sonne,Astronave e Sole,Звездолет и солнце,A Nave e o Sol,ยานอวกาศและดวงอาทิตย์,Kapal Angkasa dan Matahari,سفينة الفضاء والشمس
巡猎,Hunt,Feature,科技名称 | Research,,巡獵,순환 사냥,パトロール,Jakt,Polowanie,Jacht,Lakukan Perburuan,Cacería,Avlanma,Cuộc Săn,Chasse,Jagd,Caccia,Охота,Caça,การล่า,Memburu,الصيد
英雄战令,Champion Pass,Event,活动名称 | Event,,英雄通行證,챔피언 배틀패스,ヒーローパス,Förkämpespass,Przepustka Czempiona,Kampioenspas,Champion Pass,Pase de campeón,Kahraman Bileti,Vé Tướng,Pass Champion,"Champion-

Pass",Pass dei campioni,Пропуск защитника,Passe de Campeão,พาสแชมเปี้ยน,Pas Pejuang,بطاقة البطل
意外惊喜,Unexpected Bonus,Name,,,意外驚喜,서프라이즈,サプライズボーナス,Oväntad bonus,Nieoczekiwana premia,Onverwachte bonus,Bonus Tak Terduga,Bonificación inesperada,Beklenmedik Bonus,Thưởng Bất Ngờ,Bonus surprise,Unerwarteter Bonus,Bonus inaspettato,Неожиданный бонус,Bônus Inesperado,โบนัสที่ไม่คาดคิด,Bonus Tidak Dijangka,علاوة غير متوقعة
战争,War,Name,,,戰爭,전쟁,ウォー,Krig,Wojna,Oorlog,Perang,Guerra,Savaş,Chiến Tranh,Guerre,Krieg,Guerra,Война,Guerra,สงคราม,Peperangan,الحرب
资源自选宝箱,Resource Choice Chest,Bundle,,,資源自選寶箱,자원 선택 보물상자,資源選択BOX,Valkista med resurser,Skrzynia z zasobami do wyboru,Kist met keuze uit middelen,Peti Pilihan Sumber Daya,Cofre de selección de recursos,Kaynak Seçim Sandığı,Rương Chọn Tài Nguyên,Coffre de choix de ressources,Ressourcen-Auswahltruhe,Forziere scelta delle risorse,Кейс выбора: ресурсы,Baú de Escolha de Recursos,หีบเลือกทรัพยากร,Peti Pilihan Sumber,صندوق اختيار الموارد
宝藏,Treasure,Name,王侯技能名称 | Prince Ability,,寶藏,보물,トレジャー,Skatt,Skarb,Schat,Harta Karun,Tesoro,Hazine,Kho Báu,Trésor,Schatz,Tesoro,Сокровище,Tesouro,สมบัติ,Harta Karun,الكنز
病原控制剂,Pathogen Control Agent,Name,诺维斯生命科技蓝色订单名称 | Blue order from Novis LifeTech,,病原控制劑,병원체 억제제,病原制御剤,Medel för patogenkontroll,Czynnik kontroli patogenu,Biologische agent,Agen Kontrol Patogen,Agen. ctrl. de patógenos,Patojen Kontrol Ajanı,Chất Kiểm Soát Mầm Bệnh,Contrôle pathogène,Pathogen-Suppressor,Agente di controllo patogeno,Регулятор патогена,Agente Anti-patógenos,สารควบคุมพาโธเจน,Ejen Kawalan Patogen,عامل مكافحة العدوى
庇护,Safeguard,Skill,王侯技能名称 | Prince Ability,,庇護,보호,セーフガード,Beskydd,Obrona,Beveiliging,Pengamanan,Salvaguardia,Koruma,Bảo Hộ,Protection,Schutz,Salvaguardia,Охрана,Proteção,ปกป้อง,Melindungi,الحماية
超导矿物合金,Superconductive Alloy,Name,开拓者矿业紫色订单名称 | Purple order from Pioneer Mining,,超導礦物合金,초전도 광물 합금,超伝導合金,Superledande legering,Nadprzewodzący stop,Supergeleidende legering,Aloi Superkonduktif,Aleac. superconductora,Süper İletken Alaşım,Hợp Kim Siêu Dẫn,Alliage supraconducteur,Superleitende Legierung,Lega superconduttiva,Сверхпроводящий сплав,Liga Supercondutora,อัลลอยเหนี่ยวนำยิ่งยวด,Aloi Superkonduktif,سبيكة فائقة التوصيل
春日宝库,Springtime Vault,Event,春日庆典活动商店 | Springtime Celebration Event Shop,,春日寶庫,봄날의 금고,春の宝物庫,Vårvalvet,Wiosenny Skarbiec,Lentekluis,Vault Musim Semi,Bóveda de primavera,Bahar Kasası,Kho Mùa Xuân,Coffre Printemps,Frühlingstresor,Caveau primaverile,Весеннее Хранилище,Cofre da Primavera,ห้องนิรภัยฤดูใบไม้ผลิ,Kubah Musim Bunga,خزنة الربيع
春日签到,Springtime Sign-In,Event,2025复活节活动相关 | Related to 2025 Easter Event,,春日簽到,봄날의 출석체크,春のログインボーナス,Vårinloggning,Wiosenne meldowanie,Lente-aanmelding,Login Musim Semi,Inicio de sesión de primavera,Bahar Girişi,Đăng Nhập Mùa Xuân,Connexion Printemps,Frühlings-Anmelden,Accesso primaverile,Весенний вход,Login de Primavera,ลงชื่อเข้าใช้ในช่วงฤดูใบไม้ผลิ,Log Masuk Musim Bunga,تسجيل الدخول الربيعي
春日庆典,Springtime Celebratio,Event,2025复活节活动 | Name of 2025 Easter Event,,春日慶典,봄날의 축제,春祭り,Vårfirandet,Obchody Wiosny,Lentefeest,Perayaan Musim Semi,Celebración de primavera,Bahar Kutlaması,Lễ Hội Mùa Xuân,Fête du printemps,Frühlingsfest,Festeggiamenti di primavera,Весенний праздник,Celebração da Primavera,การฉลองฤดูใบไม้ผลิ,Perayaan Musim Bunga,احتفال الربيع
春日限定,Springtime Limited,Bundle,2025复活节活动相关 | Related to 2025 Easter Event,,春日限定,봄날 한정,春限定,Vårbegränsad,Limitowana wiosna,Exclusieve lente-editie,Musim Semi Terbatas,Por tiempo limitado en primavera,Bahar Süreli,Giới Hạn Mùa Xuân,Printemps limité,Nur im Frühling,Esclusiva primaverile,Весенний эксклюзив,Edição Limitada de Primavera,จำกัดเฉพาะฤดูใบไม้ผลิเท่านั้น,Edisi Terhad Musim Bunga,إصدار الربيع المحدود
春日战令,Springtime Pass,Item,2025复活节活动相关 | Related to 2025 Easter Event,,春日通行證,봄날의 배틀패스,春パス,Vårpasset,Wiosenna Przepustka,Lentepas,Pass Musim Semi,Pase de primavera,Bahar Bileti,Vé Mùa Xuân,Pass Printemps,Frühlingspass,Pass primaverile,Весенний пропуск,Passe de primavera,พาสฤดูใบไม้ผลิ,Pas Musim Bunga,بطاقة الربيع
初级矿物包,Mineral Pack I,Name,开拓者矿业白色订单名称 | White order from Pioneer Mining,,礦物包 I,초급 광물 팩,鉱物Ⅰパック,Mineralpaket I,Pakiet minerałów I,Mineralenbundel I,Paket Mineral I,Paquete de mineral I,Mineral Paketi I,Gói Khoáng Vật I,Pack minéral I,Mineralienpaket I,Pacchetto minerale I,Набор минералов I,Pacote de Minerais I,แพ็กแร่ธาตุ I,Pek Mineral I,حزمة المعادن I
初始映像,Default Appearance,Item,默认英雄皮肤 | Default Champion Appearance,,初始外觀,초기 외형,デフォルト,Standardutseende,Wygląd domyślny,Standaard uiterlijk,Penampilan Default,Apariencia predeterminada,Varsayılan Görünüm,Diện Mạo Mặc Định,Apparence par défaut,Standard-Aussehen,Aspetto predefinito,Стандартный облик,Aparência Padrão,ของตกแต่งเริ่มต้น,Penampilan Lalai,المظهر الافتراضي
巅峰映像,Maxed-out Appearance,Item,高级英雄皮肤 | Advanced Champion Appearance,,巔峰外觀,최상위 외형,最上級,Maxat utseende,Najlepszy możliwy wygląd,Maximale skin,Penampilan Maks,Apariencia máxima,Maksimum Görünüm,Diện Mạo Cấp Tối Đa,Apparence au max,Aussehen (max. Level),Aspetto al massimo livello,Максимальный облик,Aparência Aprimorada,ของตกแต่งสูงสุด,Penampilan Maksimum,المظهر الأقصى
帝国奢侈品箱,Imperial Luxury Crate,Name,银河帝国紫色订单名称 | Purple order from Galactic Empire,,帝國奢侈品箱,제국의 사치품 상자,帝国ラグジュアリーボックス,Imperial lyxlåda,Luksusowa skrzynia imperialna,Keizerlijke luxekist,Peti Mewah Empire,Caja de lujo imperial,İmparatorluk Lüks Kasası,Rương Sang Chảnh Đế Chế,Caisse de luxe imp.,Imperiale Luxuskiste,Cassa lusso imperiale,Имперский роскошный контейнер,Caixa de Luxo Imperial,หีบหรูจักรวรรดิ,Peti Mewah Diraja Empayar,صندوق الرفاهية الإمبراطوري
帝国文化藏品,Imperial Culture Relic,Name,银河帝国绿色订单名称 | Green order from Galactic Empire,,帝國文化藏品,제국 문화 수집품,帝国カルチャーレリック,Imperial kulturell relik,Relikt kultury Imperium,Keizerlijk cultureel artefact,Relik Budaya Empire,Reliq. cultural imperial,İmparatorluk Kültür Eseri,Di Vật Văn Hoá Đế Chế,Relique impériale,Imperiales Kulturrelikt,Reliquia della cultura imperiale,Имперская культурная реликвия,Relíquia Imperial,วัตถุโบราณวัฒนธรรมจักรวรรดิ,Artifak Budaya Empayar,أثر ثقافي إمبراطوري
帝国医疗物资,Imperial Med Supplies,Name,银河帝国蓝色订单名称 | Blue order from Galactic Empire,,帝國醫療物資,제국 의료 보급품,帝国メディカルサプライ,Imperialt sjukvårdsmaterial,Imperialne zaopatrzenie medyczne,Keizerlijke medische voorraden,Pasokan Medis Empire,Sum. méd. imperiales,İmparatorluk Medikal Malzemeleri,Vật Tư Y Tế Đế Chế,Fournitures méd. imp.,Imperiale Arzneigüter,Forniture mediche imperiali,Имперские медицинские припасы,Itens Médicos Imperiais,เสบียงทางการแพทย์จักรวรรดิ,Bekalan Perubatan Diraja,الإمدادات الطبية الإمبراطورية
动员,Mobilization,Skill,王侯技能名称 | Prince Ability,,動員,동원,動員,Mobilisering,Mobilizacja,Mobilisatie,Mobilisasi,Movilización,Seferberlik,Huy Động,Mobilisation,Mobilisieren,Mobilitazione,Мобилизация,Mobilização,การระดมสรรพกำลัง,Mobilisasi,التعبئة
防守反击I,Defensive Counter I,Name,商会科技 | Guild Research,,防守反擊I,수비 반격I,カウンターⅠ,Defensiv motattack I,Kontr-defensywa I,Defensieve counter I,Tangkisan Defensif I,Contraataque defensivo I,Savunma Karşı Saldırısı I,Phản Công Phòng Ngự I,Contre défensif I,Verteidigungskonter I,Contrattacco difensivo I,Защитный контрудар I,Contra-ataque Defensivo I,โต้กลับป้องกัน I,Tindak Balas Pertahanan I,المضاد الدفاعي I
繁荣,Prosperity,Skill,王侯技能名称 | Prince Ability,,繁榮,번영,繁栄,Välstånd,Dobrobyt,Voorspoed,Kemakmuran,Prosperidad,Refah,Phồn Vinh,Prospérité,Wohlstand,Prosperità,Процветание,Prosperidade,ความรุ่งเรือง,Kemakmuran,مزدهر
分红,Dividend,Skill,王侯技能名称 | Prince Ability,,分紅,배당,配当,Utdelning,Dywidendy,Dividend,Dividen,Dividendo,Kâr Payı,Cổ Tức,Dividende,Dividende,Dividendo,Прибыль,Dividendos,เงินปันผล,Dividen,التقسيم
高能放射晶核,High-Energy Radiant Core,Name,开拓者矿业橙色订单名称 | Orange order from Pioneer Mining,,高能放射晶核,고출력 방사 코어,高エネルギーコア,Ljusenergi med hög energi,Silne jądro energii radiantu,Hoogenergetische stralingskern,Inti Cahaya Berenergi,Núc. radiante de energía,Yüksek Enerjili Parlak Çekirdek,Lõi Quang Thể Năng Lượng Cao,Noyau rayonnant,Aktiver Radiantenkern,Nucleo radiante ad alta energia,Мощное ядро-излучатель,Núcleo de Alta Energia,แกนรัศมีพลังงานสูง,Teras Bersinar Tenaga Tinggi,النواة المشعة عالية الطاقة
贡船,Tribute Vessel,Name,至高教的大型运输船 | Ascendancy large transport ships,,貢品船,공물선,献納船,Tributfarkost,Okręt z daniną,Schattenschip,Pesawat Persembahan,Nave tributo,Haraç Gemisi,Tàu Cống Phẩm,Vaisseau de tributs,Tributschiff,Nave tributo,Корабль дани,Nave de Tributo,ยานบรรณาการ,Kapal Ufti,سفينة الإهداء
恒星宝藏,Star Treasure,Name,,,恆星寶藏,항성 보물,星の秘宝,Stjärnskatt,Gwiezdny skarb,Sterrenschat,Harta Karun Bintang,Tesoro estelar,Yıldız Hazinesi,Kho Báu Sao,Trésor des étoiles,Sternenschatz,Tesoro stellare,Звездное сокровище,Tesouro Estelar,สมบัติดวงดาว,Harta Karun Bintang,كنز النجوم
后勤物资整备,Logistical Supply Prep,Name,透光教紫色订单名称 | Purple order from Luminism,,後勤物資整備,보급 정비,兵站物資準備,Förberedelse av logistiska förnödenheter,Zaopatrzenie logistyczne,Voorbereiding voor logistische bevoorrading,Prep Pasokan Logistik,Prep. sumin. logísticos,Lojistik İkmal Hazırlığı,Chuẩn Bị Vật Tư Hậu Cần,Fournitures logistiques,Logistische Vorräte,Preparazione logistica dei rifornimenti,Подготовка снабжения,Suprimentos Logísticos,การเตรียมเสบียงโลจิสติกส์,Persediaan Bekalan Logistik,إعداد الإمدادات اللوجستية
